{
  "artifact_hashes": {
    "data-dictionary.json": "513d6ddbffb9aed7ce48c57259ac5ea3cd28b094cc51e8ea2ba9cf377ae82e5d",
    "data-product.md": "b5d36076e6e3846cf8b725ff057e05f52e930b0c22632e6cf8c411aba3ae066e",
    "data-semantic.md": "39f31e32a69409bb3bbdb6f03c874265ab7e36932cbabba20f03892cd775c906",
    "ossie-model.json": "e6a108a6b92c949182223c289f83f23bee25655de7244f936cc0fb64ed3da5b5",
    "source-manifest.json": "d287d85ca10aa835addc1d40c62eb2b08ddcee1ef6abd52feec75419fa31084a"
  },
  "completeness": 1.0,
  "hard_errors": [],
  "product_id": "prd_019ff10c-8be8-79d0-af07-21450abedf9e",
  "product_version": 1,
  "status": "PASS",
  "warnings": []
}
